{
  "$schema": "../zone.schema.json",
  "id": "undercity",
  "name": "Undercity",
  "levels": [1, 60],
  "faction": "horde",
  "kind": "city",
  "verified": false,
  "source": "draft-2026-10-26",
  "neighbors": ["tirisfal-glades"],
  "restSpots": [
    {
      "id": "undercity",
      "name": "Undercity",
      "kind": "city",
      "faction": "horde",
      "verified": false,
      "source": "draft-2026-10-26"
    }
  ],
  "quests": []
}
